wdid,name,wdLabel,gender,dob,dobPrecision,source,pid,position,psid
Q333811,John Swinney,John Swinney,male,1964-04-13T00:00:00Z,11,,Q106906212,Cabinet Secretary for Covid Recovery,Q333811-34686207-4840-e3e2-7c91-7ff889ef6cb1
Q333811,John Swinney,John Swinney,male,1964-04-13T00:00:00Z,11,,Q5261035,Deputy First Minister of Scotland,Q333811-C51D9B28-1347-425A-B9E6-30C2B394BB40
Q1738042,Keith Brown,Keith Brown,male,1961-12-20T00:00:00Z,11,,Q24197309,"Cabinet Secretary for Economy, Jobs and Fair Work",Q1738042-892da8ac-45d4-557d-461b-0994ae3ea47e
Q121780,Michael Matheson,Michael Matheson,male,1970-09-08T00:00:00Z,11,,Q5015480,Cabinet Secretary for Justice,Q121780-356344a0-46b4-20da-edc0-c28c6a80a7b5
Q467112,Nicola Sturgeon,Nicola Sturgeon,female,1970-07-19T00:00:00Z,11,,Q1362216,First Minister of Scotland,Q467112-81362a61-419c-4899-f829-7ac6b437ac12
Q444675,Shona Robison,Shona Robison,female,1966-05-26T00:00:00Z,11,,Q30762929,Cabinet Secretary for Health and Sport,Q444675-d50aab91-4b1e-27d2-e8a7-2ab94db94978
